{"agent":"codex","checks":{},"edges":[{"capability":"craft-pack","parent":"profile:service","provider":"craft-pack","reason":"Explicit desired capability"}],"execution":"not-run","files":{".agents/skills/craft-unit-testing/SKILL.md":"b5c5fd1d2fee19653a78fe7f9c8fdcadfeacb18a8ddf2820f7f7c25f935f5ff3",".agents/skills/craft-unit-testing/references/notes.md":"3ff6c05723bb069d19953340320fa9512f0be584742703e60226ded28bb43861",".agents/skills/craft-unit-testing/unit-testing":"52c784ea7ac7b21f67e2d5f070bd0f7a4c9a58c64e417653172982c525c6ccca",".govkit/packs/craft-pack/cb78db0e53b6aee6c4099898a8b65abbb1e6704b25c7034b0b1f043163965d8d/manifest.yaml":"d07a99398f11b56920949def6f05af418c706c989defbafefa0f60d5ae3b7c3a",".govkit/packs/craft-pack/cb78db0e53b6aee6c4099898a8b65abbb1e6704b25c7034b0b1f043163965d8d/skills/unit-testing/SKILL.md":"cf61b6e22233e6c513efcd8b37fc61ebac0fd9c8047f5db8abf6fcd849809021",".govkit/packs/craft-pack/cb78db0e53b6aee6c4099898a8b65abbb1e6704b25c7034b0b1f043163965d8d/skills/unit-testing/references/notes.md":"3ff6c05723bb069d19953340320fa9512f0be584742703e60226ded28bb43861",".govkit/packs/craft-pack/cb78db0e53b6aee6c4099898a8b65abbb1e6704b25c7034b0b1f043163965d8d/skills/unit-testing/unit-testing":"52c784ea7ac7b21f67e2d5f070bd0f7a4c9a58c64e417653172982c525c6ccca"},"govkit_version":"0.21.1","kind":"pack-lock","owners":{".agents/skills/craft-unit-testing/SKILL.md":"craft-pack",".agents/skills/craft-unit-testing/references/notes.md":"craft-pack",".agents/skills/craft-unit-testing/unit-testing":"craft-pack",".govkit/packs/craft-pack/cb78db0e53b6aee6c4099898a8b65abbb1e6704b25c7034b0b1f043163965d8d/manifest.yaml":"craft-pack",".govkit/packs/craft-pack/cb78db0e53b6aee6c4099898a8b65abbb1e6704b25c7034b0b1f043163965d8d/skills/unit-testing/SKILL.md":"craft-pack",".govkit/packs/craft-pack/cb78db0e53b6aee6c4099898a8b65abbb1e6704b25c7034b0b1f043163965d8d/skills/unit-testing/references/notes.md":"craft-pack",".govkit/packs/craft-pack/cb78db0e53b6aee6c4099898a8b65abbb1e6704b25c7034b0b1f043163965d8d/skills/unit-testing/unit-testing":"craft-pack"},"packs":[{"digest":"cb78db0e53b6aee6c4099898a8b65abbb1e6704b25c7034b0b1f043163965d8d","id":"craft-pack","legacy":{},"provides":["craft-pack"],"source":"local","version":"0.1.0"}],"profile":{"capabilities":[{"id":"craft-pack"}],"integrations":{"agent":"codex","ci":"github"},"policy":{"required_checks":[],"source":{"authority":"accepted","reference":"policy.md"}},"repository":{"id":"service","project_type":"api","stack":null},"schema_version":1,"source":{"authority":"accepted","reference":"policy.md"}},"profile_digest":"c48510ce3889a2599c4e9bd0c585765cb0eb6605f53a500909a822983ffacddc","required_checks":[],"schema_version":1,"skill_rendering":"install-as-v1"}
