{"agent":"claude-code","checks":{},"edges":[{"capability":"sample","parent":"profile:service","provider":"sample","reason":"Explicit desired capability"}],"execution":"not-run","files":{".claude/skills/sample-help/SKILL.md":"99e5bd3ec58a8a40cf7417deae20bb5c1bb504b6423e9546d8a456b16f9de644",".claude/skills/sample-help/agents/openai.yaml":"b13a02cee70cf93db6858361b015707843689b8a4dd441491b6ecf6fdd58e951",".claude/skills/sample-help/references/guide.md":"fde4c3d76c40a3a6d6625a31bf1fc51e4fe443ab8c9e1f7aa901507792fd05de",".govkit/packs/sample/b76faa66f5cb9ff7745e198100ef7279fad262a9897d38168e3106056d92c9ed/guide.md":"bee800c5a90e3f392bbc9a231d072924d523d0c50f2e7bd2e7cfbb8dd8962639",".govkit/packs/sample/b76faa66f5cb9ff7745e198100ef7279fad262a9897d38168e3106056d92c9ed/manifest.yaml":"0774cbcc41fadf035e251c8faf969cf6b768a6405f78dee63dc81f8e0cc3d701",".govkit/packs/sample/b76faa66f5cb9ff7745e198100ef7279fad262a9897d38168e3106056d92c9ed/skills/help/SKILL.md":"1d26ff337a468847151e2e2c5522f5f4513a5713bbc06614c619d6acca4f7a21",".govkit/packs/sample/b76faa66f5cb9ff7745e198100ef7279fad262a9897d38168e3106056d92c9ed/skills/help/agents/openai.yaml":"b13a02cee70cf93db6858361b015707843689b8a4dd441491b6ecf6fdd58e951",".govkit/packs/sample/b76faa66f5cb9ff7745e198100ef7279fad262a9897d38168e3106056d92c9ed/skills/help/references/guide.md":"fde4c3d76c40a3a6d6625a31bf1fc51e4fe443ab8c9e1f7aa901507792fd05de"},"govkit_version":"0.21.1","kind":"pack-lock","owners":{".claude/skills/sample-help/SKILL.md":"sample",".claude/skills/sample-help/agents/openai.yaml":"sample",".claude/skills/sample-help/references/guide.md":"sample",".govkit/packs/sample/b76faa66f5cb9ff7745e198100ef7279fad262a9897d38168e3106056d92c9ed/guide.md":"sample",".govkit/packs/sample/b76faa66f5cb9ff7745e198100ef7279fad262a9897d38168e3106056d92c9ed/manifest.yaml":"sample",".govkit/packs/sample/b76faa66f5cb9ff7745e198100ef7279fad262a9897d38168e3106056d92c9ed/skills/help/SKILL.md":"sample",".govkit/packs/sample/b76faa66f5cb9ff7745e198100ef7279fad262a9897d38168e3106056d92c9ed/skills/help/agents/openai.yaml":"sample",".govkit/packs/sample/b76faa66f5cb9ff7745e198100ef7279fad262a9897d38168e3106056d92c9ed/skills/help/references/guide.md":"sample"},"packs":[{"digest":"b76faa66f5cb9ff7745e198100ef7279fad262a9897d38168e3106056d92c9ed","id":"sample","legacy":{},"provides":["sample"],"source":"local","version":"1.0.0"}],"profile":{"capabilities":[{"id":"sample"}],"integrations":{"agent":"claude-code","ci":"github"},"policy":{"required_checks":[],"source":{"authority":"accepted","reference":"policy.md"}},"repository":{"id":"service","project_type":"api","stack":null},"schema_version":1,"source":{"authority":"accepted","reference":"policy.md"}},"profile_digest":"a0a367b879be58ecffff2974cb84cc975ece5cbbe1a40d7573d4ab90f1a6ddfd","required_checks":[],"schema_version":1,"skill_rendering":"install-as-v2"}
