{"agent":"codex","checks":{},"edges":[{"capability":"sample","parent":"profile:service","provider":"sample","reason":"Explicit desired capability"}],"execution":"not-run","files":{".agents/skills/sample-help/SKILL.md":"59d302e0aaabea01fc20bd1875fcde93781d7cff6f2a5ef115fcdefeaaee1f59",".agents/skills/sample-help/references/guide.md":"fde4c3d76c40a3a6d6625a31bf1fc51e4fe443ab8c9e1f7aa901507792fd05de",".govkit/packs/sample/dbda41afec85bf32e9a08065014c1be87106c0bdd5928484f7bfe40a182acb2d/guide.md":"bee800c5a90e3f392bbc9a231d072924d523d0c50f2e7bd2e7cfbb8dd8962639",".govkit/packs/sample/dbda41afec85bf32e9a08065014c1be87106c0bdd5928484f7bfe40a182acb2d/manifest.yaml":"0774cbcc41fadf035e251c8faf969cf6b768a6405f78dee63dc81f8e0cc3d701",".govkit/packs/sample/dbda41afec85bf32e9a08065014c1be87106c0bdd5928484f7bfe40a182acb2d/skills/help/SKILL.md":"1d26ff337a468847151e2e2c5522f5f4513a5713bbc06614c619d6acca4f7a21",".govkit/packs/sample/dbda41afec85bf32e9a08065014c1be87106c0bdd5928484f7bfe40a182acb2d/skills/help/references/guide.md":"fde4c3d76c40a3a6d6625a31bf1fc51e4fe443ab8c9e1f7aa901507792fd05de"},"govkit_version":"0.21.1","kind":"pack-lock","owners":{".agents/skills/sample-help/SKILL.md":"sample",".agents/skills/sample-help/references/guide.md":"sample",".govkit/packs/sample/dbda41afec85bf32e9a08065014c1be87106c0bdd5928484f7bfe40a182acb2d/guide.md":"sample",".govkit/packs/sample/dbda41afec85bf32e9a08065014c1be87106c0bdd5928484f7bfe40a182acb2d/manifest.yaml":"sample",".govkit/packs/sample/dbda41afec85bf32e9a08065014c1be87106c0bdd5928484f7bfe40a182acb2d/skills/help/SKILL.md":"sample",".govkit/packs/sample/dbda41afec85bf32e9a08065014c1be87106c0bdd5928484f7bfe40a182acb2d/skills/help/references/guide.md":"sample"},"packs":[{"digest":"dbda41afec85bf32e9a08065014c1be87106c0bdd5928484f7bfe40a182acb2d","id":"sample","legacy":{},"provides":["sample"],"source":"local","version":"1.0.0"}],"profile":{"capabilities":[{"id":"sample"}],"integrations":{"agent":"codex","ci":"github"},"policy":{"required_checks":[],"source":{"authority":"accepted","reference":"policy.md"}},"repository":{"id":"service","project_type":"api","stack":null},"schema_version":1,"source":{"authority":"accepted","reference":"policy.md"}},"profile_digest":"e9c97f0d9565227c7d59a4447b6e21148eb00a830bd0d1a2d88d5593f6ba2d1e","required_checks":[],"schema_version":1}
