{"agent":null,"checks":{},"edges":[],"execution":"not-run","files":{},"govkit_version":"0.21.1","kind":"pack-lock","owners":{},"packs":[],"profile":{"capabilities":[],"integrations":{"agent":null,"ci":"github"},"packs":[],"policy":{"conformance":{"authority":"accepted","reference":".govkit/conformance.yaml"},"contracts":[{"scope":["."],"source":{"authority":"accepted","reference":".govkit/policy.md"}}],"source":{"authority":"accepted","reference":".govkit/policy.md"},"workflows":[{"additional_checks":["project:tests","project:pipeline-contract","provider:protected-caller"],"id":"source-validation","source":{"authority":"accepted","reference":".govkit/policy.md"},"when":["*"]}]},"repository":{"id":"Accelerated-Innovation/governed-ai-delivery","project_type":"cli","stack":"python"},"schema_version":1,"source":{"authority":"accepted","reference":".govkit/policy.md"}},"profile_digest":"2d77cc0854751a69622474c115c43901ba0f35da0b8c7ab07f50c1bcaf05cda0","required_checks":[],"schema_version":1}
